<?xml version="1.0" encoding="utf8"?>
<?xml-stylesheet type="text/xsl" href="../../xslt/fcs_html.xsl"?>
<!DOCTYPE character SYSTEM "../FateCore/character.dtd">
<character>
  <id>
    <charname></charname>
    <playername>Jennifer Cornish</playername>
    <description>
      Arboe (Blue, pg 11)
      Met Junior at college on Kallistan
      homeworld's Chamber of Commerce paid for her Interplanetary Relations degree, went back home to work for them
    </description>
  </id>
  <aspects>
    <aspect type="High-Concept"></aspect>
    <aspect type="Trouble"></aspect>
    <aspect phase-num="1"></aspect>
    <aspect phase-num="2"></aspect>
    <aspect phase-num="3"></aspect>
  </aspects>
  <skills>
    <skill rating="4" name="Rapport"/>

    <skill rating="3" name="Bureaucracy"/>
    <skill rating="3" name="Intrusion"/>

    <skill rating="2" name=""/>
    <skill rating="2" name=""/>
    <skill rating="2" name=""/>

    <skill rating="1" name=""/>
    <skill rating="1" name=""/>
    <skill rating="1" name=""/>
    <skill rating="1" name=""/>
  </skills>
  <languages>
  </languages>
  <stunts>
    <stunt name="&#160;">
      &#160;
    </stunt>
    <stunt name="&#160;">
      &#160;
    </stunt>
    <stunt name="&#160;">
      &#160;
    </stunt>
  </stunts>
  <consequences>
  </consequences>
  <hacks credit-stress="true"/>
  <phase-trio>
    <phase num="1">
      <events>
        Homeworld
        "We Take Care of Our Own"
        "Live and Let Live"
        "Aspiring to Join the Protectorate"
        "Don't Underestimate Us"
        "Redneck Justice"
      </events>
    </phase>
    <phase num="2">
      <events>&#160;</events>
    </phase>
    <phase num="3">
      <events>&#160;</events>
    </phase>
  </phase-trio>
</character>
