<?xml version="1.0" encoding="utf8"?>
<?xml-stylesheet type="text/xsl" href="../../xslt/fcs_html.xsl"?>
<!DOCTYPE character SYSTEM "../FateCore/character.dtd">
<character>
  <id>
    <charname>Junior Dinkley</charname>
    <playername>Phil Bernard</playername>
    <description>
      Canid Genotype (MJ 40).
      CEO of a trading company that consists of just the PCs.
    </description>
    <homeworld name="Kallistan" ref="FH 8/67" habituated-gravity="0.9" tech-index="8"/>
  </id>
  <aspects>
    <aspect type="High-Concept">From Bastard Canid Throwaway to Secret CEO</aspect>
    <aspect type="Trouble"></aspect>
    <aspect phase-num="1"></aspect>
    <aspect phase-num="2"></aspect>
    <aspect phase-num="3"></aspect>
  </aspects>
  <skills>
    <skill rating="4" name="Science"/>

    <skill rating="3" name="Resources"/>
    <skill rating="3" name="Technical"/>

    <skill rating="2" name=""/>
    <skill rating="2" name=""/>
    <skill rating="2" name=""/>

    <skill rating="1" name=""/>
    <skill rating="1" name=""/>
    <skill rating="1" name=""/>
    <skill rating="1" name=""/>
  </skills>
  <languages>
  </languages>
  <stunts>
    <stunt name="Scent Tracking">
      Your sense of smell is far superior to that of humans. You can track and
      recognise people by scent, and gain a +2 bonus on Investigate and Notice
      rolls related to smell. (FH pg 10)
    </stunt>
    <stunt name="&#160;">
      &#160;
    </stunt>
    <stunt name="&#160;">
      &#160;
    </stunt>
  </stunts>
  <consequences>
  </consequences>
  <hacks credit-stress="true"/>
  <phase-trio>
    <phase num="1">
      <events>
        Rich canid, paid by family to stay away from home.
        The Dinkley family owns (among other things) a huge portion of Daedelus Corporation.
      </events>
    </phase>
    <phase num="2">
      <events>&#160;</events>
    </phase>
    <phase num="3">
      <events>&#160;</events>
    </phase>
  </phase-trio>
  <notes>
    Trouble: Enemies of the Family? (Or within the family?)
    Questions:
      Are you just an aimless drifter, or do you have some plan for your life?
  </notes>
</character>
